name,url,brief_description,features,pros,cons,user_reviews,pricing,rating,category,source_site
Write Your First Smart Contract on Flow Blockchain,https://metaschool.so/courses/write-fungible-token-flow-blockchain,Get familiar with the Flow Blockchain and Cadence programming language by writing a smart contract and shipping a fungible token with this 4 hour course.,,Metaschool is an inspiration to newbees  in the Blockchain industry. It exposes them to series of platforms where they can learn the technology at no cost. Continue the good work!; Metaschool is an inspiration to newbees  in the Blockchain industry. It exposes them to series of platforms where they can learn the technology at no cost. Continue the good work!,i need more advanced courses on flow blockchain; i need more advanced courses on flow blockchain,,Free,,,Metaschool
Build a Code Translator Using NextJS and OpenAI API,https://metaschool.so/courses/build-a-code-translator-using-nextjs-and-openai-api,The internet's always been a quirky place. Why should AI chatbots be formal then? Learn how to code your very own personalized AI chatbot today with this course.,,The internet's always been a quirky place. Why should AI chatbots be formal then? Learn how to code your very own personalized AI chatbot today with this course.; it is best way to learn and I recommend this for everyone who want to learn new things.; It was great to learn more about API and how to integrate them in our websites and apps.,,,Free,,,Metaschool
Build a YeBot with OpenAI API,https://metaschool.so/courses/build-a-yebot-with-openai-api,Ever wondered whether Kanye intelligence can outperform artificial intelligence? Build your own chatbot in our Kanye-themed AI prompt engineering training and find out whose intelligence reigns supreme. This detailed one-of-a-kind AI chatbot is inspired b,,,,,"NFTs are not entirely dead. If anything, the NFT market will be worth $231 billi...",,,Metaschool
Create Your Own Token on Binance,https://metaschool.so/courses/how-to-create-your-own-token-on-binance,Enroll now to learn to create and mint your own token on Binance. Interested in building dApps? Enroll today.,,"Enroll now to learn to create and mint your own token on Binance. Interested in building dApps? Enroll today.; Easy course, what a great way to learn I love it.; Easy course, what a great way to learn I love it.",,,"The average salary for a Solidity developer is over $150,000 p/a.",,,Metaschool
Introduction to Polygon and its Architecture,https://metaschool.so/courses/introduction-to-polygon-and-its-architecture,"Explore key features of Polygon's Layer 2 scaling solution, and learn how it enhances scalability, security, and interoperability for decentralized applications.",,"Explore key features of Polygon's Layer 2 scaling solution, and learn how it enhances scalability, security, and interoperability for decentralized applications.; It is great learning, But some terms can be made simple.; Deep, quick, Enjoyable learning courses being offered here.",,,"The average salary for a Solidity developer is over $150,000 p/a",,,Metaschool
Develop a Blockchain with Rust on Substrate,https://metaschool.so/courses/how-to-create-your-own-blockchain,"Got a blockchain idea but don’t know how to build one? Lucky for you, developing blockchains is no longer an elusive dream. Try out this course today.",,"Can be used to build applications in various domains like machine learning, finance, etc.; In this course, you’ll learn how to create your own decentralized exchange appli...; If you’re a developer looking to add Fuel Blockchain to your skillset, this is t...","Some steps and commands are confusing, you can make it more clear. Like in windows it needs WSL2 instead of WSL, etc. Latest version of substrate-node-template did nor work for me on WSL, so I have to update it to WSL2.; Some steps and commands are confusing, you can make it more clear. Like in windows it needs WSL2 instead of WSL, etc. Latest version of substrate-node-template did nor work for me on WSL, so I have to update it to WSL2.",,Free,,,Metaschool
Create Your Own Ethereum Token in Just 30 Mins,https://metaschool.so/courses/create-your-own-ethereum-token-in-just-30-mins,A short and helpful hands-on course on minting an Ethereum token in just under 30 minutes. Enroll now.,,"I found this course to be incredibly informative and well-organized. The material was presented in a clear and engaging manner, making it easy to stay focused and learn. Highly recommended!; I found this course to be incredibly informative and well-organized. The material was presented in a clear and engaging manner, making it easy to stay focused and learn. Highly recommended!; The best way to learn Solidity is to start coding in Solidity. Do yourself a fav...",,,"Its truly helpful 
Thankyou so much for providing this quality of education for free",,,Metaschool
Create Your Own Solana Token in 10 Minutes,https://metaschool.so/courses/create-your-own-solana-token-in-just-10-mins,Improve your token minting capabilities by enrolling in this course that helps you create a Solana token in just 10 minutes. Enroll today.,,"It was really helpful to learn basics about solana tokens.; It was really helpful to learn basics about solana tokens.; Can be used to build applications in various domains like machine learning, finance, etc.",,,Free,,,Metaschool
Build your own web3 X dApp with Solidity,https://metaschool.so/courses/build-your-own-web3-x-dapp-with-solidity,"Interested in building dApps? Begin with building the dApp of your favorite social media platform, Twitter. Enroll today.",,,,,"The average salary for a Solidity developer is over $150,000 p/a.",,,Metaschool
Launch your own token on Polygon Network in 30 mins,https://metaschool.so/courses/launch-your-own-token-on-polygon-network-in-30-mins,Want to know how to develop a smart contract to create a token on Polygon? Turn your curiosity into knowledge with this beginner tutorial today.,,"I would definitely recommend Metaschool to friends or colleagues who are interested in learning about blockchain and token creation. The tutorial on how to create a token was exceptionally well explained, providing a clear and deep understanding of t; I would definitely recommend Metaschool to friends or colleagues who are interested in learning about blockchain and token creation. The tutorial on how to create a token was exceptionally well explained, providing a clear and deep understanding of t; I would definitely recommend Metaschool to friends or colleagues who are interested in learning about blockchain and token creation. The tutorial on how to create a token was exceptionally well explained, providing a clear and deep understanding of t",,,"The average salary for a Solidity developer is over $150,000 p/a.",,,Metaschool
Create NFTs Using Different Token Standards,https://metaschool.so/courses/creating-nfts-using-different-token-standards,Learn the art of minting NFTs on any token standard to up your NFT game and enhance your minting skills. Enroll now.,,Learn the art of minting NFTs on any token standard to up your NFT game and enhance your minting skills. Enroll now.; good to learn the basics of the blockchain technology; good to learn the basics of the blockchain technology,Not much explanation on how to use the contract on remix. struggled with some of the requirements; Not much explanation on how to use the contract on remix. struggled with some of the requirements,,"The average salary for a Solidity developer is over $150,000 p/a.",,,Metaschool
Launch your own epic NFT marketplace,https://metaschool.so/courses/launch-your-own-epic-nft-marketplace,Explore the essential steps and strategies to create & operate a successful marketplace for non-fungible tokens. Join this popular (and free) course now.,,"I'm happy at this moment, learning to mint my own NFTs here; I'm happy at this moment, learning to mint my own NFTs here; I'm happy at this moment, learning to mint my own NFTs here","This is nice, I would suggest to add more complex and complete logic to understand the actual requirements; This is nice, I would suggest to add more complex and complete logic to understand the actual requirements",,Explore the essential steps and strategies to create & operate a successful marketplace for non-fungible tokens. Join this popular (and free) course now.,,,Metaschool
Create a Horoscope Web3 NFT Application,https://metaschool.so/courses/create-a-horoscope-web3-nft-application,"This 2-hour course shows how to build a simple web app that mints NFTs on Ethereum. Mint an NFT, ship to testnet and interact with it. Ready to build?",,"I am very happy that I am one step closer to web3 through this course. Although I encountered some difficulties in the learning process, the overall experience is still very good, and it is very suitable for a novice like me.; I am very happy that I am one step closer to web3 through this course. Although I encountered some difficulties in the learning process, the overall experience is still very good, and it is very suitable for a novice like me.; I am very happy that I am one step closer to web3 through this course. Although I encountered some difficulties in the learning process, the overall experience is still very good, and it is very suitable for a novice like me.",Loved the way path is structured but content needs to be updated time to time. some of the blockchain networks are outdated and had to use alternatives to complete the lessons.; Loved the way path is structured but content needs to be updated time to time. some of the blockchain networks are outdated and had to use alternatives to complete the lessons.; Loved the way path is structured but content needs to be updated time to time. some of the blockchain networks are outdated and had to use alternatives to complete the lessons.,,"The average salary for a Solidity developer is over $150,000 p/a.",,,Metaschool
Add MetaMask connect button to your react app,https://metaschool.so/courses/add-metamask-connect-button-to-your-react-app,A mini project to help you add connect MetaMask wallet functionality in your app.,,I've learned to connect to the MetaMask wallet with Ethers.js in React. Super happy!; I really enjoy learning about web 3; I've learned to connect to the MetaMask wallet with Ethers.js in React. Super happy!,,,Free,,,Metaschool
Write Your First Solidity Smart Contract on Ethereum,https://metaschool.so/courses/writing-your-first-hello-world-contract-in-solidity,Looking for an easy Solidity tutorial? Enroll in this 'best ranked' course on developing a smart contract on Ethereum with Solidity programming language.,,metaschool still needs to provide a more guidance in the learning process; metaschool still needs to provide a more guidance in the learning process,metaschool still needs to provide a more guidance in the learning process; metaschool still needs to provide a more guidance in the learning process,,"The average salary for a Solidity developer is over $150,000 p/a",,,Metaschool
Write an Elon Musk NFT Smart Contract on OpenSea,https://metaschool.so/courses/how-to-write-a-smart-contract-and-mint-elon-musk-nft-on-opensea,Ever wanted to mint an NFT on OpenSea? Learn how by writing an ERC-721 token smart contract with this popular tutorial. 8500+ developers enrolled.,,Ever wanted to mint an NFT on OpenSea? Learn how by writing an ERC-721 token smart contract with this popular tutorial. 8500+ developers enrolled.; The best way to learn Solidity is to start coding in Solidity. Do yourself a fav...; The best way to learn Solidity is to start coding in Solidity. Do yourself a fav...,Content needs to evolve.  Or version numbers of npm libraries should be shared. There are breking changes in OpenZeppellin 5 and ethers library.; Content needs to evolve.  Or version numbers of npm libraries should be shared. There are breking changes in OpenZeppellin 5 and ethers library.,,"The average salary for a Solidity developer is over $150,000 p/a",,,Metaschool
Learn everything about NFTs,https://metaschool.so/courses/learn-everything-about-nfts,"Dive deep into NFTs: Understand their workings, uses, and creation. Perfect for beginners and aspiring NFT developers alike.",,"I got to learn many new things about NFTs like what is the purpose and how its used. And, I found the documentation very concise and insightful.; Unlike other resources on the internet, metaschool makes Web3 concepts more easy to learn; I got to learn many new things about NFTs like what is the purpose and how its used. And, I found the documentation very concise and insightful.",,,"NFTs are not entirely dead. If anything, the NFT market will be worth $231 billi...",,,Metaschool
